"Table 2-8:  Emissions and Removals (Net Flux) from Land Use, Land-Use Change, and Forestry (MMT CO2 Eq.)",,,,,,,,,,,,,,,,,,,,,,,,,,
,,,,,,,,,,,,,,,,,,,,,,,,,,
,Gas/Land-Use Category,1990,1991,1992,1993,1994,1995,1996,1997,1998,1999,2000,2001,2002,2003,2004,2005,2006,2007,2008,2009,2010,2011,2012,2013,2014
,Net CO2 Fluxa,-753,-755.2,-757.7,-740.1,-762.6,-713.8,-721.2,-708.6,-696.7,-705,-708.2,-701.5,-695.1,-700.6,-711.2,-726.7,-744.9,-723.7,-712.4,-756.2,-784.3,-784.9,-782,-783.7,-787
,Forest Land Remaining Forest Landb,-723.5,-729.4,-726.1,-728,-718.5,-707.4,-693.9,-686.9,-686.9,-686.9,-657.8,-658.9,-658.3,-672.5,-673.3,-691.9,-698.7,-682.2,-667.4,-712.3,-742,-736.7,-735.8,-739.1,-742.3
,Land Converted to Forest Land,-0.7,-0.7,-0.7,-0.8,-0.9,-1,-0.9,-1,-1,-1.1,-1,-1,-0.9,-0.9,-0.8,-0.8,-0.4,-0.4,-0.4,-0.4,-0.4,-0.4,-0.4,-0.3,-0.3
,Cropland Remaining Cropland,-34.3,-36.2,-38.2,-17,-28.3,-22.3,-29.7,-27.9,-13.7,-26.8,-31.8,-30.6,-21.6,-11.5,-14.8,-14.1,-13.8,-14.7,-6.5,1.5,1.8,-12.5,-11.2,-9.3,-8.4
,Land Converted to Cropland,65.7,64,63.2,59.6,53.8,63.4,59.4,59.7,51.7,49.4,44.2,42.6,40.7,37.4,33.1,32.2,31.4,24.8,24.9,22.9,23.7,21.6,22,22.1,22.1
,Grassland Remaining Grassland,-12.9,-3.7,-5.1,-5,-20.9,-4.2,-12.8,-6.3,-10.3,-0.9,-16.6,-6.2,-5.7,-4.2,-5.2,-3.3,-12.5,3,-6.8,-8.9,-7.3,3.1,3.6,3.8,3.8
,Land Converted to Grassland,39.1,37.2,36.5,36.8,36.9,40.8,39.3,37.3,47.2,46.8,43,42,41.4,41.2,40.5,43.1,42.1,39.4,38.2,38.5,39.3,39.9,40.4,40.4,40.4
,Settlements Remaining Settlements,-60.4,-61.9,-63.3,-64.7,-66.2,-67.6,-69.1,-70.5,-72,-73.4,-74.9,-76,-77.2,-78.3,-79.4,-80.5,-81.6,-82.8,-83.9,-85,-86.1,-87.3,-88.4,-89.5,-90.6
,Other: Landfilled Yard Trimmings and Food Scraps,-26,-24.4,-23.9,-21,-18.6,-15.4,-13.4,-12.9,-11.7,-12.1,-13.3,-13.3,-13.5,-11.7,-11.2,-11.4,-11.3,-10.7,-10.7,-12.5,-13.2,-12.7,-12.2,-11.7,-11.6
,CO2,8.1,8.3,7.8,7.4,7.8,8.1,7.9,8,8.8,8.7,8.8,9,9.6,9.3,8.7,9,8.8,9.3,9.6,8.2,9.6,8.9,11,9,9.5
,Cropland Remaining Cropland: CO2 Emissions from Urea Fertilization,2.4,2.3,2.4,2.6,2.7,2.7,2.6,2.7,2.9,3,3.2,3.4,3.6,3.7,3.7,3.5,3.7,3.8,3.6,3.6,3.8,4.1,4.2,4.3,4.5
,Cropland Remaining Cropland: CO2 Emissions from Liming,4.7,5,4.4,3.8,4.1,4.4,4.4,4.3,4.7,4.5,4.3,4.4,5,4.6,3.9,4.3,4.2,4.5,5,3.7,4.8,3.9,6,3.9,4.1
,Wetlands Remaining Wetlands: Peatlands Remaining Peatlands,1.1,1,0.9,1,0.9,1.1,0.9,1.1,1.1,1.2,1.3,1.2,1,1,1.2,1.1,0.9,1,1,1,1,0.9,0.8,0.8,0.8
,CH4,3.3,3.7,1.7,0.9,5.8,0.8,3.8,0.5,2.1,5,8.3,4.4,12,6.6,12,9.9,8.4,12.3,8,7.1,3.3,6.6,11.1,7.3,7.4
,Forest Land Remaining Forest Land: Non-CO2 Emissions from Forest Fires,3.3,3.7,1.6,0.9,5.8,0.8,3.8,0.5,2.1,5,8.3,4.4,12,6.6,12,9.9,8.4,12.3,8,7.1,3.3,6.6,11.1,7.3,7.3
,Wetlands Remaining Wetlands: Peatlands Remaining Peatlands,+ ,+ ,+ ,+ ,+ ,+ ,+ ,+ ,+ ,+ ,+ ,+ ,+ ,+ ,+ ,+ ,+ ,+ ,+ ,+ ,+ ,+ ,+ ,+ ,+ 
,N2O,3.6,3.9,2.7,2.5,5.9,2.5,4.6,2.5,3.4,5.6,8,5.7,10.7,7.3,10.8,9.3,8.3,11,8.1,7.3,5,7.3,10.3,7.7,7.7
,Forest Land Remaining Forest Land: Non-CO2 Emissions from Forest Fires,2.2,2.4,1.1,0.6,3.8,0.5,2.5,0.3,1.4,3.3,5.5,2.9,7.8,4.4,7.9,6.5,5.5,8.1,5.3,4.6,2.2,4.4,7.3,4.8,4.8
,Settlements Remaining Settlements: N2O Fluxes from Settlement Soilsc,1.4,1.4,1.5,1.7,1.9,1.7,1.8,1.8,1.6,1.7,2,2.3,2.3,2.4,2.4,2.3,2.4,2.5,2.3,2.2,2.4,2.5,2.5,2.4,2.4
,Forest Land Remaining Forest Land: N2O Fluxes from Forest Soilsd,0.1,0.1,0.1,0.2,0.2,0.3,0.4,0.4,0.4,0.6,0.5,0.5,0.6,0.5,0.5,0.5,0.5,0.5,0.5,0.5,0.5,0.5,0.5,0.5,0.5
,Wetlands Remaining Wetlands: Peatlands Remaining Peatlands,+ ,+ ,+ ,+ ,+ ,+ ,+ ,+ ,+ ,+ ,+ ,+ ,+ ,+ ,+ ,+ ,+ ,+ ,+ ,+ ,+ ,+ ,+ ,+ ,+ 
,LULUCF Emissionse,15,15.9,12.2,10.9,19.5,11.4,16.3,11.1,14.3,19.3,25.2,19,32.3,23.2,31.5,28.2,25.5,32.6,25.7,22.6,17.8,22.9,32.3,24.1,24.6
,LULUCF Total Net Fluxa,-753,-755.2,-757.7,-740.1,-762.6,-713.8,-721.2,-708.6,-696.7,-705,-708.2,-701.5,-695.1,-700.6,-711.2,-726.7,-744.9,-723.7,-712.4,-756.2,-784.3,-784.9,-782,-783.7,-787
,LULUCF Sector Totalf,-738,-739.3,-745.5,-729.2,-743.1,-702.4,-704.9,-697.5,-682.3,-685.7,-683,-682.4,-662.8,-677.4,-679.7,-698.5,-719.4,-691.1,-686.7,-733.6,-766.4,-762,-749.7,-759.6,-762.5
,+ Does not exceed 0.05 MMT CO2 Eq.,,,,,,,,,,,,,,,,,,,,,,,,,
,"a Net CO2 flux is the net C stock change from the following categories: Forest Land Remaining Forest Land, Land Converted to Forest Land, Cropland Remaining Cropland, Land Converted to Cropland, Grassland Remaining Grassland, Land Converted to Grassland, Settlements Remaining Settlements, and Other.",,,,,,,,,,,,,,,,,,,,,,,,,
,b Includes the effects of net additions to stocks of carbon stored in forest ecosystem pools and harvested wood products.,,,,,,,,,,,,,,,,,,,,,,,,,
,c Estimates include emissions from N fertilizer additions on both Settlements Remaining Settlements and Land Converted to Settlements.,,,,,,,,,,,,,,,,,,,,,,,,,
,d Estimates include emissions from N fertilizer additions on both Forest Land Remaining Forest Land and Land Converted to Forest Land.,,,,,,,,,,,,,,,,,,,,,,,,,
,"e LULUCF emissions include the CO2, CH4, and N2O emissions reported for Non-CO2 Emissions from Forest Fires, N2O Fluxes from Forest Soils, CO2 Emissions from Liming, CO2 Emissions from Urea Fertilization, Peatlands Remaining Peatlands, and N2O Fluxes from Settlement Soils.",,,,,,,,,,,,,,,,,,,,,,,,,
,"f The LULUCF Sector Total is the net sum of all emissions (i.e., sources) of greenhouse gases to the atmosphere plus removals of CO2 (i.e., sinks or negative emissions) from the atmosphere.",,,,,,,,,,,,,,,,,,,,,,,,,
,Notes:  Totals may not sum due to independent rounding. Parentheses indicate net sequestration.,,,,,,,,,,,,,,,,,,,,,,,,,
